{
  "id": "qa",
  "summary": "在实现前写验收测试，并执行验收报告。",
  "usesModel": true,
  "promptRef": "qa.md",
  "writes": ["tests/acceptance/**", "evidence/qa/**"],
  "reads": ["packages/contracts/**", "fixtures/**"],
  "tools": ["read_file", "write_acceptance_tests", "run_acceptance_tests"],
  "transitions": [
    { "from": "ready", "to": "running" },
    { "from": "running", "to": "review", "requiresGate": "acceptance" }
  ],
  "modelPolicy": {
    "defaultModel": "qwen-plus-2025-07-14",
    "defaultEffort": "high",
    "mustDifferFrom": ["coder"]
  },
  "skills": [
    { "id": "testing", "scope": "role", "state": "active" }
  ]
}
